{
  "$schema": "http://json-schema.org/draft-07/schema#",
  "title": "TraceShareGate report",
  "type": "object",
  "additionalProperties": false,
  "properties": {
    "schemaVersion": {
      "enum": [1]
    },
    "tool": {
      "type": "object",
      "additionalProperties": false,
      "properties": {
        "name": {
          "enum": ["tracesharegate"]
        },
        "version": {
          "type": "string",
          "pattern": "^0\\.[0-9]+\\.[0-9]+$"
        }
      },
      "required": ["name", "version"]
    },
    "input": {
      "type": "object",
      "additionalProperties": false,
      "properties": {
        "sha256": {
          "type": "string",
          "pattern": "^[a-f0-9]{64}$"
        },
        "bytes": {
          "type": "integer",
          "minimum": 0
        }
      },
      "required": ["sha256", "bytes"]
    },
    "policy": {
      "type": "object",
      "additionalProperties": false,
      "properties": {
        "id": {
          "type": "string",
          "maxLength": 8192
        },
        "version": {
          "type": "integer",
          "minimum": 0
        },
        "fingerprint": {
          "type": "string",
          "pattern": "^[a-f0-9]{64}$"
        }
      },
      "required": ["id", "version", "fingerprint"]
    },
    "processingStatus": {
      "enum": ["complete", "incomplete", "unsupported"]
    },
    "needsReview": {
      "enum": [true]
    },
    "coverage": {
      "type": "object",
      "additionalProperties": false,
      "properties": {
        "archiveInventory": {
          "enum": ["complete"]
        },
        "recognizedSchema": {
          "enum": ["complete", "incomplete", "unsupported"]
        },
        "processedRetainedFields": {
          "enum": ["complete", "incomplete"]
        },
        "patternMatching": {
          "enum": ["bounded-built-ins"]
        },
        "literalCheck": {
          "enum": ["performed", "not-performed"]
        },
        "events": {
          "type": "integer",
          "minimum": 0
        },
        "streams": {
          "type": "integer",
          "minimum": 0
        },
        "assertionScope": {
          "enum": ["runner-observations", "browser-only", "unknown"]
        },
        "issues": {
          "type": "array",
          "items": {
            "type": "object",
            "additionalProperties": false,
            "properties": {
              "code": {
                "enum": [
                  "unsupported-event-structure",
                  "unknown-entry-category",
                  "invalid-event-structure",
                  "unsupported-trace-metadata",
                  "unknown-origin",
                  "duplicate-context-metadata",
                  "missing-context-metadata",
                  "unverified-network-scope",
                  "unknown-network-event",
                  "missing-trace-stream",
                  "unresolved-resource-reference",
                  "unknown-event-kind",
                  "unknown-schema-field",
                  "unknown-error-field",
                  "invalid-call-id",
                  "unknown-operation",
                  "invalid-start-time",
                  "duplicate-before",
                  "duplicate-after",
                  "orphan-after",
                  "invalid-duration",
                  "invalid-error-structure",
                  "unfinished-action",
                  "unverified-parent",
                  "unknown-error-context",
                  "error-context-limit"
                ]
              },
              "entryId": {
                "anyOf": [
                  {
                    "type": "string",
                    "pattern": "^entry-[1-9][0-9]{0,6}$"
                  },
                  {
                    "type": "null"
                  }
                ]
              },
              "eventIndex": {
                "anyOf": [
                  {
                    "type": "integer",
                    "minimum": 0
                  },
                  {
                    "type": "null"
                  }
                ]
              },
              "schemaPath": {
                "enum": [
                  "events",
                  "events[]",
                  "archive.entries[]",
                  "events[].context-options",
                  "events[].origin",
                  "events[].operation",
                  "events[].error.message",
                  "events[].error.name",
                  "events[].resourceReference",
                  "actions[].parentId"
                ]
              },
              "count": {
                "type": "integer",
                "minimum": 1
              }
            },
            "required": ["code", "entryId", "eventIndex", "schemaPath", "count"]
          },
          "maxItems": 20000
        }
      },
      "required": [
        "archiveInventory",
        "recognizedSchema",
        "processedRetainedFields",
        "patternMatching",
        "literalCheck",
        "events",
        "streams",
        "assertionScope",
        "issues"
      ]
    },
    "redactionSummary": {
      "type": "array",
      "items": {
        "type": "object",
        "additionalProperties": false,
        "properties": {
          "ruleId": {
            "enum": [
              "known-literal",
              "literal-uri",
              "literal-json",
              "literal-nfc",
              "url",
              "home-path",
              "absolute-path",
              "email",
              "bearer",
              "jwt",
              "credential-assignment",
              "synthetic-canary",
              "ansi",
              "bidi",
              "control",
              "error-context",
              "error-assertion-values",
              "error-diff",
              "error-call-log",
              "error-source-context",
              "error-unknown-context",
              "error-context-limit",
              "error-custom-message",
              "error-locator-context",
              "oversize-string"
            ]
          },
          "field": {
            "enum": ["errors[].name", "errors[].message"]
          },
          "count": {
            "type": "integer",
            "minimum": 1
          }
        },
        "required": ["ruleId", "field", "count"]
      },
      "maxItems": 100
    },
    "omissionSummary": {
      "type": "array",
      "items": {
        "type": "object",
        "additionalProperties": false,
        "properties": {
          "category": {
            "enum": [
              "arguments-and-results",
              "test-and-step-titles",
              "console-and-stdio",
              "dom-and-aria",
              "images-and-video",
              "network",
              "cookies-and-storage",
              "source-and-stacks",
              "attachments",
              "arbitrary-resources"
            ]
          },
          "eventCount": {
            "type": "integer",
            "minimum": 0
          },
          "entryCount": {
            "type": "integer",
            "minimum": 0
          },
          "resourceReferenceCount": {
            "type": "integer",
            "minimum": 0
          },
          "reason": {
            "enum": [
              "excluded-by-minimal-v1",
              "excluded-by-minimal-v1-policy-2"
            ]
          }
        },
        "required": [
          "category",
          "eventCount",
          "entryCount",
          "resourceReferenceCount",
          "reason"
        ]
      },
      "maxItems": 20
    },
    "adapter": {
      "type": "object",
      "additionalProperties": false,
      "properties": {
        "id": {
          "enum": ["playwright-1.63.0-v9"]
        },
        "version": {
          "enum": ["1"]
        },
        "playwright": {
          "enum": ["1.63.0"]
        },
        "traceVersion": {
          "enum": [9]
        },
        "sourceCommit": {
          "enum": ["1b025d7e20a026371cd5f98ba0cdce48892737c8"]
        }
      },
      "required": [
        "id",
        "version",
        "playwright",
        "traceVersion",
        "sourceCommit"
      ]
    },
    "contexts": {
      "type": "array",
      "items": {
        "type": "object",
        "additionalProperties": false,
        "properties": {
          "id": {
            "type": "string",
            "pattern": "^context-[1-9][0-9]{0,6}$"
          },
          "lane": {
            "type": "string",
            "pattern": "^lane-[1-9][0-9]{0,6}$"
          },
          "origin": {
            "enum": ["runner", "browser", "unknown"]
          },
          "clock": {
            "enum": ["stream-relative"]
          },
          "assertionObservations": {
            "enum": ["recorded", "not-observed", "out-of-scope"]
          }
        },
        "required": ["id", "lane", "origin", "clock", "assertionObservations"]
      },
      "maxItems": 128
    },
    "actions": {
      "type": "array",
      "items": {
        "type": "object",
        "additionalProperties": false,
        "properties": {
          "id": {
            "type": "string",
            "pattern": "^action-[1-9][0-9]{0,6}$"
          },
          "contextId": {
            "type": "string",
            "pattern": "^context-[1-9][0-9]{0,6}$"
          },
          "lane": {
            "type": "string",
            "pattern": "^lane-[1-9][0-9]{0,6}$"
          },
          "operation": {
            "enum": [
              "Create page",
              "Close context",
              "Create context",
              "Close browser",
              "Navigate",
              "Fill input",
              "Click",
              "Double click",
              "Press key",
              "Check control",
              "Uncheck control",
              "Hover",
              "Select option",
              "Wait for element",
              "Wait",
              "Locator assertion",
              "Evaluate",
              "Capture screenshot",
              "Close page",
              "Reload",
              "Wait for event",
              "Test hook",
              "Test fixture",
              "Browser API step",
              "Test step",
              "Attach data",
              "Assertion",
              "Skipped step",
              "Trace group",
              "HTTP request",
              "Unknown operation"
            ]
          },
          "operationKnown": {
            "type": "boolean"
          },
          "startMs": {
            "anyOf": [
              {
                "type": "number",
                "minimum": -1000000000000000,
                "maximum": 1000000000000000
              },
              {
                "type": "null"
              }
            ]
          },
          "endMs": {
            "anyOf": [
              {
                "type": "number",
                "minimum": -1000000000000000,
                "maximum": 1000000000000000
              },
              {
                "type": "null"
              }
            ]
          },
          "durationMs": {
            "anyOf": [
              {
                "type": "number",
                "minimum": 0,
                "maximum": 1000000000000000
              },
              {
                "type": "null"
              }
            ]
          },
          "outcome": {
            "enum": ["passed", "failed", "incomplete", "unknown"]
          },
          "parentId": {
            "anyOf": [
              {
                "type": "string",
                "pattern": "^action-[1-9][0-9]{0,6}$"
              },
              {
                "type": "null"
              }
            ]
          },
          "errorIds": {
            "type": "array",
            "items": {
              "type": "string",
              "pattern": "^error-[1-9][0-9]{0,6}$"
            },
            "maxItems": 10000
          },
          "eventIndex": {
            "type": "integer",
            "minimum": 0
          }
        },
        "required": [
          "id",
          "contextId",
          "lane",
          "operation",
          "operationKnown",
          "startMs",
          "endMs",
          "durationMs",
          "outcome",
          "parentId",
          "errorIds",
          "eventIndex"
        ]
      },
      "maxItems": 50000
    },
    "errors": {
      "type": "array",
      "items": {
        "type": "object",
        "additionalProperties": false,
        "properties": {
          "id": {
            "type": "string",
            "pattern": "^error-[1-9][0-9]{0,6}$"
          },
          "contextId": {
            "type": "string",
            "pattern": "^context-[1-9][0-9]{0,6}$"
          },
          "actionId": {
            "anyOf": [
              {
                "type": "string",
                "pattern": "^action-[1-9][0-9]{0,6}$"
              },
              {
                "type": "null"
              }
            ]
          },
          "name": {
            "anyOf": [
              {
                "type": "string",
                "maxLength": 8192
              },
              {
                "type": "null"
              }
            ]
          },
          "message": {
            "anyOf": [
              {
                "type": "string",
                "maxLength": 8192
              },
              {
                "type": "null"
              }
            ]
          },
          "timeMs": {
            "anyOf": [
              {
                "type": "number",
                "minimum": -1000000000000000,
                "maximum": 1000000000000000
              },
              {
                "type": "null"
              }
            ]
          },
          "eventIndex": {
            "type": "integer",
            "minimum": 0
          }
        },
        "required": [
          "id",
          "contextId",
          "actionId",
          "name",
          "message",
          "timeMs",
          "eventIndex"
        ]
      },
      "maxItems": 10000
    },
    "limitations": {
      "type": "array",
      "items": {
        "type": "string",
        "maxLength": 8192
      },
      "maxItems": 20
    }
  },
  "required": [
    "schemaVersion",
    "tool",
    "input",
    "policy",
    "processingStatus",
    "needsReview",
    "coverage",
    "redactionSummary",
    "omissionSummary",
    "adapter",
    "contexts",
    "actions",
    "errors",
    "limitations"
  ]
}
